Index	Tanggal	Kategori	Tema	Pertanyaan	Jawaban	Dasar Hukum	Editor
180760	11 Mei 2022	Tanya-SC	Lainnya	"(twitter): https://twitter.com/fitriLb1/status/1523447442741825536 izin tanya ""mohon info utk jasa konstruksi setor sendiri pembuatan id billing nya pada pph unifikasi dipisah ya dengan id billing jasa konstruksi (bukti potong) ? Thx"" ini MAP dan KJS nya juga memang beda ya mas mba?"	iya betul, berbeda menunya juga. Setor sendiri sama bikin bukpot	iya betul, berbeda menunya juga. Setor sendiri sama bikin bukpot	LIA DESI ARTANTI
180761	19 Mei 2022	Tanya-SC	KUP	https://twitter.com/sidharmo/status/1527141728461148165 '@kring_pajak mohon bantuan sy salah buat kode billing untk bayar ppn masa bulan april 2022 malah kde billing untk ppn bm masa bulan april, sy sudah proses PBK ke KPP tapi proses nya 2 minggu otomatis sudah lewat bulan mei 2022, padahal batas waktu lapor ppn masa april kan 31 mei.D9	ini salah satu konsekuensi pbk ya mas, karena memang butuh proses untuk penyelesaian permohonannya. Sebenernya bisa dg disetor kembali dg kap kjs yg sesuai, nanti atas pembayaran yg salah bisa diajukan pbk ke jenis pajak yang lain atau tetap bisa diakui di spt ppn masa april (melalui pembetulan, jika spt normal sudah dilapor) kemudian atas LBnya bisa dikompen ke masa pajak berikutnya	ini salah satu konsekuensi pbk ya mas, karena memang butuh proses untuk penyelesaian permohonannya. Sebenernya bisa dg disetor kembali dg kap kjs yg sesuai, nanti atas pembayaran yg salah bisa diajukan pbk ke jenis pajak yang lain atau tetap bisa diakui di spt ppn masa april (melalui pembetulan, jika spt normal sudah dilapor) kemudian atas LBnya bisa dikompen ke masa pajak berikutnya	LIA DESI ARTANTI
180762	19 Mei 2022	Tanya-SC	KUP	"https://twitter.com/sidharmo/status/1527142117361188864 saya mau lapor ppn april 2022 tapi haru memasukan ntpn, ketika saya gunakan ntpan yan ppn bm april 2022 ""Kode Pajak Tidak Sesuai"""	ini masi nyambung sama yg tadi kyknya ya mas. Bener kok, ga bakalan bisa disubmit klo map kjs beda karena sistem ngevalidasi.	ini masi nyambung sama yg tadi kyknya ya mas. Bener kok, ga bakalan bisa disubmit klo map kjs beda karena sistem ngevalidasi.	LIA DESI ARTANTI
180763	19 Mei 2022	Tanya-SC	KUP	infonya ini dilihat dari saat pembayarannya bang, kalau terutang april tapi pembayarannya mei bisa langsung pake npwp ip	infonya ini dilihat dari saat pembayarannya bang, kalau terutang april tapi pembayarannya mei bisa langsung pake npwp ip	infonya ini dilihat dari saat pembayarannya bang, kalau terutang april tapi pembayarannya mei bisa langsung pake npwp ip	LIA DESI ARTANTI
180764	19 Mei 2022	Tanya-SC	Lainnya	https://twitter.com/rizkaARST/status/1527138883103694848 pembuktiannya itu setau aku cuma pada saat pemeriksaan pas cek invoice, surat jalan dll. apakah dimungkinkan dengan hal lain?? terima kasiiii	produk hukumnya kan STP ya kalau terlambat terbit faktur, ga harus lewat pemeriksaan si seharusnya kalo STP. Pembuktiannya ya nanti tergantung kpp-nya, penelitian juga bisa harusnya ya	produk hukumnya kan STP ya kalau terlambat terbit faktur, ga harus lewat pemeriksaan si seharusnya kalo STP. Pembuktiannya ya nanti tergantung kpp-nya, penelitian juga bisa harusnya ya	LIA DESI ARTANTI
180765	24 Mei 2022	Tanya-SC	PPh	"@kring_pajak Selamat Sore kak. Mau bertanya, jika kriteria sbb : 1. WP badan merupakan usaha di bidang managemen konstruksi (jasa estimasi biaya konstruksi) 2. Pengerjaan usaha tersebut di dalam negeri 3. Pengguna jasa tersebut WP Luar Negeri non BUT P1874. Yang mengerjakan merupakan WP dalam negeri Wajib pajak badan ini akan melaporkan spt tahunan badan 2021, tarif pph mana yg berlaku? Di peraturan apa dan pasal berapa ya kak yang menyebutkan pengguna jasa dari WPLN ? Mohon jawabannya. ????. Terima kasih"""	yg mjd objek pajak adalah penghasilan baik dari dalam negeri maupun luar negeri yg dpt menambah kemampuan ekonomis. Terkait ph atas konstruksi ini kan diatur khusus di pp jasa konstruksi, mungkin bisa dipastikan dulu masuk ke pph final jasa konstruksi apa engga (untuk tahun 2021 masih menggunakan ketentuan pp 51 2008, objeknya adalah pekerjaan konstruksi meliputi perencanaan, pelaksanaan, dan pengawasan), kalau masuk penghasilan dari pekerjaan konstruksi berarti tarifnya sesuai pasal 3 pp 51 2008. Kalau ga masuk lingkup penghasilan final jasa konstruksi, berarti kena tarif pph umum (pasal 7 pp 51). Ada pemotongan pph dr LN-nya atau nggak? Kalau ada bisa jadi kredit pajak (pasal 7 ayat 1 pp 51), ketentuan pengkreditannya bisa dilihat di pmk 192 2018	yg mjd objek pajak adalah penghasilan baik dari dalam negeri maupun luar negeri yg dpt menambah kemampuan ekonomis. Terkait ph atas konstruksi ini kan diatur khusus di pp jasa konstruksi, mungkin bisa dipastikan dulu masuk ke pph final jasa konstruksi apa engga (untuk tahun 2021 masih menggunakan ketentuan pp 51 2008, objeknya adalah pekerjaan konstruksi meliputi perencanaan, pelaksanaan, dan pengawasan), kalau masuk penghasilan dari pekerjaan konstruksi berarti tarifnya sesuai pasal 3 pp 51 2008. Kalau ga masuk lingkup penghasilan final jasa konstruksi, berarti kena tarif pph umum (pasal 7 pp 51). Ada pemotongan pph dr LN-nya atau nggak? Kalau ada bisa jadi kredit pajak (pasal 7 ayat 1 pp 51), ketentuan pengkreditannya bisa dilihat di pmk 192 2018	LIA DESI ARTANTI
180766	24 Mei 2022	Tanya-SC	PPN	"(Email) : Kepada Yth Informasi Perpajakan, Sesuai dengan UU No 7 Tahun 2021 tentang Harmonisasi Peraturan Perpajakan (UU HPP), disebutkan bahwa per 1 April 2022 : Jasa Pelayanan Kesehatan Medis sudah bukan termasuk ke Jenis Jasa yang tidak dikenai PPN, namun termasuk ke dalam Jasa tertentu yang diberikan fasilitas Bebas PPN. Atas hal ini ada beberapa hal yang ingin kami konfirmasi sebagai berikut : Sebelum adanya peraturan yang baru, penyerahan di Rumah Sakit kami membagi jadi 2 yaitu Rawat Jalan dan Rawat Inap. *untuk penyerahan yg di Rawat Jalan masuk ke Penyerahan yang terutang PPN (masuk di bagian penyerahan yg digunggung di SPT PPN) * untuk penyerahan yg di Rawat Inap masuk ke Penyerahan yang tidak terutang PPN (langsung masuk di SPT PPN Bagian Induk bagian Penyerahan yg tidak terutang PPN) Mohon infonya, dengan adanya peraturan baru ini, 1. Terkait pengakuan dan penulisan Penyerahan Rawat Inap di SPT Masa PPN 1a) Kami memahami bahwa atas penyerahan Rawat Inap (Jasa Pelayanan Kesehatan) sekarang termasuk ke Jasa yang diberikan fasilitas Bebas PPN (bukan lagi termasuk ke Jasa yg tidak dikenai PPN) Lalu apakah RS harus menerbitkan FP dengan kode 080 setiap kali ada penyerahan Rawat Inap? atau boleh langsung dimasukkan saja ke ""Penyerahan yang digunggung"" di SPT PPN (kemudian kami akan membuat FP bagi PKP Pedagang eceran sesuai Pasal 25 dalam Per 3 PJ 2022?) Mengingat pasien Rawat Inap sangat banyak, sehingga tidak mungkin kalau harus membuat faktur pajak kode 080 untuk semua pasien Rawat Inap satu per satu. 1b) Menyambung pertanyaan di 1a, mohon penjelasannya, Kalau diperbolehkan untuk Penyerahan Rawat Inap yang termasuk dalam fasilitas bebas PPN itu untuk langsung dimasukkan di bagian ""Penyerahan yang digunggung', nanti cara penulisan di SPT PPN nya bagaimana ya? Apakah di bagian DPP penyerahan digunggung diisi nilai DPP, lalu di bagian nilai PPN diisi 0 ? Mengingat untuk Rawat Inap (Jasa Pelayanan Kesehatan) termasuk Jasa yang diberikan fasilitas Bebas PPN sehingga seharusnya PPN nya juga 0. 2. Terkait Perhitungan Kembali PPN Masukan (Pedoman Perhitungan Pengkreditan Pajak Masukan) Sebelum ada nya peraturan baru, yaitu pada saat Jasa Pelayanan Kesehatan masih diakui sebagai Jasa yang tidak dikenai PPN, RS kami melakukan pedoman perhitungan pengkreditan Pajak Masukan (Perhitungan kembali PPN Masukan). Hal ini dikarenakan ada Pajak Masukan atas perolehan obat yang belum dapat dipastikan penggunaannya untuk penyerahan yang terutang PPN (Rawat Jalan) dan penyerahan yang tidak terutang PPN (Rawat Inap). Pertanyaan kami, dengan adanya peraturan yang baru, dimana sekarang Jasa Pelayanan Kesehatan termasuk ke jasa yang diberikan fasilitas Bebas PPN, bagaimana perlakuannya? Apakah kami harus tetap melakukan pedoman perhitungan pengkreditan Pajak Masukan? Mengingat didalam peraturan terkait pedoman perhitungan pengkreditan Pajak Masukan, dikatakan bahwa PM yang perlu dihitung kembali adalah jika PKP melakukan : Penyerahan yang terutang Pajak & Penyerahan yang tidak terutang Pajak? Sedangkan karena adanya peraturan yang baru ini, semua jasa RS menjadi terutang Pajak (hanya saja mendapat fasilitas dibebaskan)? Mohon tanggapannya mengingat peraturan yang baru sudah berlaku per April 2022 dan akan mempengaruhi perhitungan SPT PPN Masa April 2022 yang harus kami laporkan akhir bulan Mei ini Terima kasih"	1a. fp 07 atau 08 bagi pedagang eceran tetap dapat menggunakan fp bagi pedagang eceran (masuk ke ppn digunggung) sepanjang penyerahannya dilakukan kepada konsumen akhir 1b. Betul, untuk transaksi yg dapat fasilitas 07 08, inputnya cukup dpp saja, ppn 0 2. Kalau fasilitas dibebaskan kan tetep sama perlakuannya ya kayak bukan objek, pm-nya tidak bisa dikreditkan. Jd untuk mekanisme pengkreditan pajak masukannya kemungkinan masih sama	1a. fp 07 atau 08 bagi pedagang eceran tetap dapat menggunakan fp bagi pedagang eceran (masuk ke ppn digunggung) sepanjang penyerahannya dilakukan kepada konsumen akhir 1b. Betul, untuk transaksi yg dapat fasilitas 07 08, inputnya cukup dpp saja, ppn 0 2. Kalau fasilitas dibebaskan kan tetep sama perlakuannya ya kayak bukan objek, pm-nya tidak bisa dikreditkan. Jd untuk mekanisme pengkreditan pajak masukannya kemungkinan masih sama	LIA DESI ARTANTI
180767	24 Mei 2022	Tanya-SC	PPh	"email ""Namun ketentuan lebih lanjut mengenai biaya penggantian atau imbalan yang diberikan dalam bentuk natura dan/atau kenikmatan yang dapat dikurangkan dari penghasilan bruto diatur lebih lanjut dengan Peraturan Pemerintah (Pasal 32C huruf n UU PPh)."" Saya mau menanyakan, untuk PP yang mengatur Medical check up sebagai Natura ada di PP mana ya?"	masih belum terbit PPnya, ditunggu dulu ya	masih belum terbit PPnya, ditunggu dulu ya	LIA DESI ARTANTI
180768	10 Mei 2022	Tanya-SC	Lainnya	saya mau bayar PPh 23 tapi kenapa ebupotnya gabisa dibuka terus. loading doang abis itu tulisan website gabisa dibuka	per pagi ini dibilang masi dalam penanganan, coba secara berkala dulu yaa sambil c3l	per pagi ini dibilang masi dalam penanganan, coba secara berkala dulu yaa sambil c3l	LIA DESI ARTANTI
180769	10 Mei 2022	Tanya-SC	Lainnya	mas mba ebupot eror kah?	info tadi pagi masih dalam penanganan sih, ebupot biasa kan ya? dicoba secara berkala aja yaa, sambil c3l	info tadi pagi masih dalam penanganan sih, ebupot biasa kan ya? dicoba secara berkala aja yaa, sambil c3l	LIA DESI ARTANTI
180770	10 Mei 2022	Tanya-SC	Lainnya	untuk pph 15 di ebupot unifikasi identitas wajib pajak yang di potong di isi apa ya? wp merupakan perusahaan pelayaran dalam negeri yang penghasilannya diperoleh bukan berdasarkan perjanjian persewaan atau charter dengan pemotong pajak. mekanismenya setor sendiri kan mas/mba? lalu pengisian identitas pajak yang dipotong, apakah data wp itu sendiri juga?	iya setor sendiri, harusnya ga input identitas wp yg dipotong	iya setor sendiri, harusnya ga input identitas wp yg dipotong	LIA DESI ARTANTI
180771	10 Mei 2022	Tanya-SC	PPN	Mohon maaf izin bertanya mas mbak, untuk jasa kena pajak berupa jasa kesehatan yang langsung diberikan kepada pasien, apakah ini bisa dianggap sebagai penyerahan kepada konsumen akhir PKP PE sbgmn diatur PMK-18/2021? Jika bisa, berarti untuk total penyerahannya bisa di-input pada PPN digunggung ya mas mbak? Terima kasih mas mbak sebelumnya, mohon maaf mengganggu	Ga dilarang, sepanjang memenuhi kriteria pkp pe bisa aja pake fp digunggung	Ga dilarang, sepanjang memenuhi kriteria pkp pe bisa aja pake fp digunggung	LIA DESI ARTANTI
180772	10 Mei 2022	Tanya-SC	Lainnya	saya mau tanya spt unifikasi untuk pemotongan pp 23 tahun 2018 aya buat kode 411128-423 ssp dengan pembayaran menggunakan npwp yang dipotong tetapi di spt unifikasi tidak terdata sehingga masih ada selisih pph yang harus dibayar sehingga tidak bisa dilaporkan untuk spt unifikasi ini apakah membuat bukti potong atau bagaimana? mohon dibantu mas/mba	Harusnya iya sih bikin bukpot, direkam di bukti potong final	Harusnya iya sih bikin bukpot, direkam di bukti potong final	LIA DESI ARTANTI
180773	10 Mei 2022	Tanya-SC	E-Faktur	mas/mba ijin bertanya, wp lupa akun dan password efaktur, kemudian reset password di enofa, kemudian restart dan mencoba kembali status profil wp, status aplikasi efaktur dekstop belum registrasi, itu bagaimana ya?	Ini belum registrasi karena dia melakukan reset aplikasi client. Kalo reset aplikasi harus regis ulang dg kode aktivasi efaktur dekstop (bisa diliat di enofa). Nanti regis ulang, pake db dan aplikasi baru	Ini belum registrasi karena dia melakukan reset aplikasi client. Kalo reset aplikasi harus regis ulang dg kode aktivasi efaktur dekstop (bisa diliat di enofa). Nanti regis ulang, pake db dan aplikasi baru	LIA DESI ARTANTI
180774	10 Mei 2022	Tanya-SC	E-SPT	Mohon maaf izin bertanya mas mbak, utk SPT PPN PUT 1107, defaultnya masih 10%, kalau input transaksi skrg, supaya tarif 11%, diubah secara manual pada nilai PPN-nya ya mas mbak? Terima kasih sebelumnya	Iya, gabisa ubah manual tarif. Kalo mau ubah di fakturnya. Dari tik juga infonya blm ada perubahan aplikasi, jd masih pake yg itu. Sementara ubah manual aja di kolom ppn nya, kalau ragu coba konfirmasi ke kpp gpp karna emang blm ada update aplikasi	Iya, gabisa ubah manual tarif. Kalo mau ubah di fakturnya. Dari tik juga infonya blm ada perubahan aplikasi, jd masih pake yg itu. Sementara ubah manual aja di kolom ppn nya, kalau ragu coba konfirmasi ke kpp gpp karna emang blm ada update aplikasi	LIA DESI ARTANTI
180775	10 Mei 2022	Tanya-SC	PPN	Selamat sore saya ingin bertanya untuk voucher game, aspek PPN nya bagaimana yah? tolong dilampirkan juga aturanya	wp no respon	wp no respon	LIA DESI ARTANTI
180776	10 Mei 2022	Tanya-SC	PPN	jika yang menyerahkan merupakan distibutor pulsa tingkat lanjut, apakah terutang PPN jg ka? jika terutang PPN, FP yg harus diterbitkan, kode nya apa?	pmk 6 pasal 13 ayat 3, wp no respon/offline	pmk 6 pasal 13 ayat 3, wp no respon/offline	LIA DESI ARTANTI
180777	11 Mei 2022	Tanya-SC	DJP Online	ijin kak. perihal aplikasi e-bupot klik pra pelaporan selalu kembali lagi ke halaman utama informasi di reload terus sampai akhirnya error 500	dicoba bisa, diarahkan untuk coba lgsg ke ebupot.pajak.go.id	dicoba bisa, diarahkan untuk coba lgsg ke ebupot.pajak.go.id	LIA DESI ARTANTI
180778	11 Mei 2022	Tanya-SC	Lainnya	saya sedang melakukan perekaman bukti potong lalu saat di bagian akhir, yg isi penandatangan kok dari kemarin selalu eror yaaa dan nama direktur penandatangan ga muncul	wp belum rekam penandatangan	wp belum rekam penandatangan	LIA DESI ARTANTI
180779	11 Mei 2022	Tanya-SC	Lainnya	ijin kak. pada saat submit e-form spt tahunan badan pembetulan thn 2017 keterangan spt gagal dikirim	"Jika submit e-Form mengalami SPT Tidak Valid, Silakan lakukan pengecekan penyebab permasalahan, antara lain : 1. Tidak boleh ada angka desimal kecuali 1771 USD 2. Tidak boleh ada ampersand (&) 3. Tahun Pajak harus 4 Digit di Lamp khusus 1A 4. Tanggal harus menggunakan format DD/MM/YYYY 5. Pilihan tarif harus dipilih 6. Pada Penyusutan harus memilih Garis Lurus bukan GL atau Saldo Menurun bukan SM 7. Tidak boleh ada karakter double quote ( "" ) 8. KLU harus terisi / Bukan KLU error"	"Jika submit e-Form mengalami SPT Tidak Valid, Silakan lakukan pengecekan penyebab permasalahan, antara lain : 1. Tidak boleh ada angka desimal kecuali 1771 USD 2. Tidak boleh ada ampersand (&) 3. Tahun Pajak harus 4 Digit di Lamp khusus 1A 4. Tanggal harus menggunakan format DD/MM/YYYY 5. Pilihan tarif harus dipilih 6. Pada Penyusutan harus memilih Garis Lurus bukan GL atau Saldo Menurun bukan SM 7. Tidak boleh ada karakter double quote ( "" ) 8. KLU harus terisi / Bukan KLU error"	LIA DESI ARTANTI
180780	11 Mei 2022	Tanya-SC	PPN	aya mau tanya, kalau kita ada transaksi dengan pihak jasa outsource, ada biaya tenaga kerja dan ada fee outsourcenya, nilai dpp yg dibuat utk faktur pajak pakai nilai yang mana? feenya saja atau total keseluruhan?	uu hpp, jasa tenaga kerja pasal 16B, tp blm ada aturan turunannya	uu hpp, jasa tenaga kerja pasal 16B, tp blm ada aturan turunannya	LIA DESI ARTANTI
180781	11 Mei 2022	Tanya-SC	E-SPT	mau tanya perihal aplikasi ESPT ppn 1107 putversi 3.0, tarifnya belum update masih 10%, diganti manual namun berubah kembali ke 10%	betul mas, blm ada update untuk aplikasinya masih pake v3.0 ini wpnya instansi pemerintah apa bukan?	betul mas, blm ada update untuk aplikasinya masih pake v3.0 ini wpnya instansi pemerintah apa bukan?	LIA DESI ARTANTI
180782	11 Mei 2022	Tanya-SC	Lainnya	mau tanya kalau ebuni wp op sewa TB, input bukti setornya cukup di menu pajak penghasilan setor sndiri (slide 64) atau input jg di menu spt masa perekaman bukti setor (slide 132 ppt ebuni)?	harusnya cukup setor sendiri	harusnya cukup setor sendiri	LIA DESI ARTANTI
180783	11 Mei 2022	Tanya-SC	PPh	mau tanya terkait worlwide/source based income untuk industri OCC (marketing - financial service). Apakah eligible agar income yang dikenakan pajak hanya yang berasal dari Indonesia saja?	wp no respon	wp no respon	LIA DESI ARTANTI
180784	11 Mei 2022	Tanya-SC	Lainnya	WP mau pembetulan SPT Masa PPh 23 masa oktober 2021 melalui ebupot 23/26 namun daftar bukti potongnya tidak muncul. Selain C3L, incognito dan private window ada solusi lain Mas/Mbak?	coba berkala, c3l	coba berkala, c3l	LIA DESI ARTANTI
180785	11 Mei 2022	Tanya-SC	KUP	Halo, saya ingin baru2 ini mencari tahu untuk aturan pajak dan pembuatan NPWP untuk orang yang bekerja di luar negeri. Saya lihat di website ini : https://www.pajak.go.id/id/tenaga-kerja-indonesia-di-luar-negeri, orang indonesia yg bekerja di luar negeri dibedakan jadi SPLN dan SPDN ya. SPLN hanya terkena pajak atas penghasilan yg di dapat di Indonesia, berdsar lama tinggal di luar negeri dalam 12 bulan terakhir. Untuk pembuatan NPWP bagi SPLN, apakah dimungkinkan ya? saya kebetulan sudah bekerja di luar negeri hingga 2 tahun belakangan. Lalu, saya dengar2 untuk sementara waktu, untuk orang yg bekerja di luar negeri, bisa membuat NPWP Non Efektif setelah membuat NPWP agar tak lapor SPT sementara hingga saat kembali nanti di Indonesia. Apakah NPWP NE ini dapat kita apply online ya? Lalu, misalnya kita memiliki penghasilan dr Indonesia sebagai SPLN, misal dari sewa rumah, bgmn cara pelaporan pajaknya ya? terimakasih	Spln ga bikin npwp sih ya mas. Kalo spln bikin npwp nanti jadinya spdn Npwp NE bisa online. Tp maksudnya ini gimana? Kalo awal daftar npwp kan ada tuh pilihannya mau diNEkan atau engga, bisa dari situ. Atau kalo udah punya npwp mau diNE-kan, prosedurnya selain ke kpp paling lewat kring pajak, itupun hanya untuk op kriteria abc sesuai pasal 24 per 04 Spln punya penghasilan sewa rumah, ini mekanismenya pemotongan nanti, yg lapor juga wp pemotongnya	Spln ga bikin npwp sih ya mas. Kalo spln bikin npwp nanti jadinya spdn Npwp NE bisa online. Tp maksudnya ini gimana? Kalo awal daftar npwp kan ada tuh pilihannya mau diNEkan atau engga, bisa dari situ. Atau kalo udah punya npwp mau diNE-kan, prosedurnya selain ke kpp paling lewat kring pajak, itupun hanya untuk op kriteria abc sesuai pasal 24 per 04 Spln punya penghasilan sewa rumah, ini mekanismenya pemotongan nanti, yg lapor juga wp pemotongnya	LIA DESI ARTANTI
180786	19 Mei 2022	Tanya-SC	Lainnya	wp mau rekam bupot setor sendiri di unifikasi, muncul seperti ini mas/mba,	wp salah pilih menu, harusnya rekam di bukti penyetoran tapi salah pilih menu setor sendiri	wp salah pilih menu, harusnya rekam di bukti penyetoran tapi salah pilih menu setor sendiri	LIA DESI ARTANTI
180787	19 Mei 2022	Tanya-SC	Lainnya	WP LN ebupot kalau ga ada tin apa bisa pake nomer paspor?	TIN tidak divalidasi, bisa diisi 000 kalau memang lawan transaksi tidak memiliki tin. Lawan transaksi dr timor leste, infonya di sana bebas pajak jd tidak ada tin	TIN tidak divalidasi, bisa diisi 000 kalau memang lawan transaksi tidak memiliki tin. Lawan transaksi dr timor leste, infonya di sana bebas pajak jd tidak ada tin	LIA DESI ARTANTI
180788	19 Mei 2022	Tanya-SC	Lainnya	selamat siang pak agus.. saya mau konsultasi mengenai bagaimana cara pelaporan pph psal 4(2) atas shu di ebupot unifikasi terimakasih saya dr koperasi ada pembagian shu setiap tahun.. biasanya saya laporakan pakai efilling dengan kode objek pajak 411128-419 karena sekarang pakai ebupot unifikasi belum paham cara pengerjaannya terimakasih	Sejak berlakunya uu cika, shu koperasi masuk ke pasal 4 ayat 3, bukan objek	Sejak berlakunya uu cika, shu koperasi masuk ke pasal 4 ayat 3, bukan objek	LIA DESI ARTANTI
180789	19 Mei 2022	Tanya-SC	PPN	apabila saya akan menagih ke pihak penjual.. tp surat jalan dan SPPB nya tgl 15/3/22.. boleh kah saya terbitin FP keluaran di bulan mei ini? ini tetap bisa kan ya mas/mba?	dalam ketentuan hanya disebutkan kalau untuk menerbitkan fp 07 harus ada sppb dulu. Sepanjang sppb-nya memang atas transaksi tsb gapapa ya harusnya	dalam ketentuan hanya disebutkan kalau untuk menerbitkan fp 07 harus ada sppb dulu. Sepanjang sppb-nya memang atas transaksi tsb gapapa ya harusnya	LIA DESI ARTANTI
180790	19 Mei 2022	Tanya-SC	PPN	mas/mba, pasal 2 ayat 5 PER 03 tahun 2022 itu merupakan fp digunggung yg buat PKP PE ya? keterangan di pasal tsb selaras sama pembuatan fp pkp pe sesuai dengan pasal 80 ayat 2 PMK 18 Tahun 2021. bener gt nggak ya?	iya betul	iya betul	LIA DESI ARTANTI
180791	19 Mei 2022	Tanya-SC	Lainnya	Saya ingin tanya kemarin saya melakukan PBK atas PPN dalam negeri bkp tak berwujud. sudah diterbitkan PBK nya. setelah dokumen pbk sudah di terbitkan apa yang harus saya lakukan yah. terima kasih	wp no respon	wp no respon	LIA DESI ARTANTI
180792	19 Mei 2022	Tanya-SC	PPN	saya mau buat FP dengan kode 07, tapi kode cap nya masih ke default yg PP No. 10 Tahun 2012 saya sudah sincronize kode cap, sudah 2x bu sudah restart efaktur 2x trus pc juga sampe direstart tapi tetap masuk ke e faktur pas pilih kode 07 keluarnya masih kode cap yg lama. Mohon bantuannya mas/mba	Sepertinya wp salah milih keterangan tambahan, harusnya pilih yang kawasan berikat pp 41, tp wp no respon saat diminta screenshot lagi	Sepertinya wp salah milih keterangan tambahan, harusnya pilih yang kawasan berikat pp 41, tp wp no respon saat diminta screenshot lagi	LIA DESI ARTANTI
180793	24 Mei 2022	Tanya-SC	PPN	Selamat Pagi, saya ingin bertanya perihal pengubahan penandatangan di faktur pajak,saya sudah rubah dengan nama yg baru, tapi ketika upload namanya masih dengan nama yg lama, ini kenapa namanya belum berubah mengikuti update yg baru ya pak/ bu?	rekam fakturnya setelah diubah penandatangannya kah? Lanjut pm	rekam fakturnya setelah diubah penandatangannya kah? Lanjut pm	LIA DESI ARTANTI
180794	24 Mei 2022	Tanya-SC	KUP	jadi kemarin ada PPN JLN yang sudah lewat dari 3 bulan dan belum dilakukan pembayaran, setelah itu ada audit pak, dimana ada LB, bagaimana metode pengkreditan PPN JLN apabila tidak melalui pelunasan, tetapi melalui pemotongan dari LB nya?	tidak bisa, harus bayar dulu pmnya	tidak bisa, harus bayar dulu pmnya	LIA DESI ARTANTI
180795	02 Juni 2022	Tanya-SC	Lainnya	ijin tanya, wp menerima hibah rumah dari tantenya, rumah dibeli tahun 2000, cuman baru taun ini di urus surat hibah dan balik nama. ini kalo ikut pps ikut ke kebijakan berapa ya mas/mba?	Kembali ke saat perolehan hartanya kapan. Harta yg dilaporkan di spt adalah harta yg dimiliki dan/atau dikuasai, mungkin bisa mengacu ke ketentuan tsb.	Kembali ke saat perolehan hartanya kapan. Harta yg dilaporkan di spt adalah harta yg dimiliki dan/atau dikuasai, mungkin bisa mengacu ke ketentuan tsb.	LIA DESI ARTANTI
180796	02 Juni 2022	Tanya-SC	Lainnya	apakah tetap wajib melaporkan laporan realisasi sedangkan saya tidak menginvestasikan harta saya? alasan: memang tidak berniat untuk menginvestasikan dan belum dilaporkan pada SPT Tahunan 2020	Wp menggunakan tarif 14%, kalau tarifnya udah bener bukan yg investasi berarti ga perlu lapor realisasi	Wp menggunakan tarif 14%, kalau tarifnya udah bener bukan yg investasi berarti ga perlu lapor realisasi	LIA DESI ARTANTI
180797	02 Juni 2022	Tanya-SC	PPh	Ada jurnal penyesuaian terhadap aset (reclass/adjustment), tapi di eform kolom harga perolehan dan penyusutan tidak bisa diisikan minus. Di espt sebelumnya bisa. Emang harusnya bisa ya, mas/mbak?	wp ada double catat tahun sebelumnya, kalau salah input ya pembetulan	wp ada double catat tahun sebelumnya, kalau salah input ya pembetulan	LIA DESI ARTANTI
180798	03 Juni 2022	Tanya-SC	PPh	jk dividen diterima wp op tp tdk diinvestasikan baik diterima dr perusahaan luar negeri/dalam negeri, kena pph pasal 4 ayat 2 tarif 10% kak?	dividen diterima perusahaan dalam negeri, iya final 10% setor sendiri	dividen diterima perusahaan dalam negeri, iya final 10% setor sendiri	LIA DESI ARTANTI
180799	03 Juni 2022	Tanya-SC	PPN	Izin bertanya, Mas/Mba. Jadi PT. A adalah anak perusahaan dari PT. B. Kedua perusahaan tersebut akan melakukan company outing. Namun untuk biaya tiketnya akan dibayar oleh PT. A dahulu dan akan direimburse pada parent company yaitu PT.B Untuk reimbursement tersebut apakah perlu dikenakan PPN juga saat mengirimkan request reimbursement kepada PT. B ?	Kalo ada biaya tambahan ya kemungkinan kena ppn, diliat dulu biaya tambahannya sebagai apa (biasanya sih jasa/komisi). Kalau gaada ya enggak dikenakan, jatohnya kyk penyerahan uang tunai jd ga kena ppn	Kalo ada biaya tambahan ya kemungkinan kena ppn, diliat dulu biaya tambahannya sebagai apa (biasanya sih jasa/komisi). Kalau gaada ya enggak dikenakan, jatohnya kyk penyerahan uang tunai jd ga kena ppn	LIA DESI ARTANTI
